{
  "engine": {
    "id": "A",
    "llmModel": "ollama/gemma3:4b",
    "promptVersion": "extract-ko-v2-items",
    "reader": "",
    "workerVersion": "0.1.1"
  },
  "items": [
    {
      "area": "SCHOOL",
      "confidence": 0.95,
      "details": "",
      "endAt": "2026-10-22T16:00:00+09:00",
      "evidence": {
        "dateText": "내일",
        "sentence": "학부모 상담 있고",
        "timeText": "오후 3시"
      },
      "kind": "SCHEDULE",
      "needsReview": false,
      "reminderAt": "2026-10-22T15:00:00+09:00",
      "reviewReasons": [],
      "startAt": "2026-10-22T15:00:00+09:00",
      "title": "학부모 상담"
    },
    {
      "area": "SCHOOL",
      "confidence": 0.9,
      "details": "교무실 책상 위",
      "endAt": "",
      "evidence": {
        "dateText": "",
        "sentence": "상담 자료는 교무실 책상 위에 있다는 거 기억해 줘",
        "timeText": ""
      },
      "kind": "NOTE",
      "needsReview": false,
      "reminderAt": "",
      "reviewReasons": [],
      "startAt": "",
      "title": "상담 자료 위치"
    }
  ],
  "needsReview": false,
  "referenceTime": "2026-10-21T09:00:00+09:00",
  "reviewReasons": [],
  "schemaVersion": 1,
  "source": {
    "bytes": 114,
    "format": "txt",
    "sha256": "f39f637df861409319709ed96d5db7d9cf65ff77f5f3b3c1ad15effe20b9e61e",
    "type": "text"
  },
  "sourceText": "내일 오후 3시에 학부모 상담 있고 상담 자료는 교무실 책상 위에 있다는 거 기억해 줘",
  "summary": "학부모 상담 및 상담 자료 위치 기억",
  "timings": {
    "llmMs": 8675,
    "readMs": 0,
    "totalMs": 8675
  }
}
